Invoice ID,Invoice #,Invoice Date,Supplier,Total
227,THL0200024546 - B,12/11/18,Intercom with Thailand,214000.00
229,HKG38032097 - A,10/09/18,PricewaterhouseCoopers Ltd-3rd-party (PHL-PricewaterhouseCoopers Ltd-),6360249.00
230,1021502 - A,04/09/19,Rajah and Tann Singapore LLP O (PHL-Rajah and Tann Singapore LLP O-),4205.10
235,20190305  - A,04/09/19,The Government of the HKSAR (PHL-The Government of the HKSAR),5950.00
228,GH2738 - A,12/14/18,Prudential Services (Prudential Services Limited),780103.00
